{
  "slug": "cbs-statline",
  "naam": "CBS StatLine",
  "type": "overheid",
  "website": "https://www.cbs.nl/",
  "beschrijving": "Databank met de statistieken van het Centraal Bureau voor de Statistiek. De tabellen zijn ook als open data via een OData-API op te halen; de inhoud staat onder CC BY 4.0."
}
