{
  "slug": "liander",
  "naam": "Liander",
  "type": "netbeheerder",
  "website": "https://www.liander.nl/",
  "beschrijving": "Regionale netbeheerder voor elektriciteit en gas in onder meer Noord-Holland, Flevoland, Gelderland en delen van Friesland en Zuid-Holland. Publiceert open data over verbruik, teruglevering, opwek en transportprognoses."
}
