{
  "slug": "klimaatmonitor",
  "naam": "Regionale klimaatmonitor",
  "type": "overheid",
  "website": "https://klimaatmonitor.databank.nl/",
  "beschrijving": "Open-dataportaal met regionale uitsplitsingen van landelijke cijfers over energiegebruik, hernieuwbare opwek en klimaatbeleid, tot op gemeenteniveau. Beheerd door de Rijksdienst voor Ondernemend Nederland (RVO).",
  "voorbeeld": true
}
