{
  "slug": "entsoe-transparency",
  "naam": "ENTSO-E Transparency Platform",
  "type": "markt",
  "website": "https://transparency.entsoe.eu/",
  "beschrijving": "Europees transparantieplatform voor elektriciteitsdata van de samenwerkende transmissienetbeheerders. Type en beschrijving te controleren.",
  "voorbeeld": true
}
