{
  "slug": "rivm",
  "naam": "RIVM",
  "type": "onderzoek",
  "website": "https://www.rivm.nl/",
  "beschrijving": "Rijksinstituut voor Volksgezondheid en Milieu. Beheert in opdracht van het ministerie van Economische Zaken en Klimaat de netkaart met de Nederlandse bovengrondse hoogspanningslijnen en de rekenafstanden voor magneetveldzones."
}
